{
  "id": "a1b2c3d4-e5f6-7890-abcd-ef1234567890",
  "project_id": "00000000-0000-4000-8000-000000000001",
  "analysis_run_id": "00000000-0000-4000-8000-000000000002",
  "parser_id": "typescript",
  "schema_version": "1",
  "generated_at": "2026-07-12T00:00:00.000Z",
  "files_analyzed": ["src/main.ts"],
  "model": {
    "symbols": [
      {
        "name": "main",
        "kind": "function",
        "path": "src/main.ts",
        "qualified_name": "main"
      }
    ]
  },
  "stored_at": "2026-07-12T00:00:01.000Z"
}
